question,matching,not_matching
How do people on a ketogenic diet typically manage their electrolytes?,"They use supplements, increase sodium intake, and drink electrolyte drinks.","They use supplements, increase sodium intake, and drink electrolyte drinks."
What are some reasons for increasing sodium intake in diets according to the comments?,Sodium is important to prevent electrolyte imbalances on keto.,Sodium is important to prevent electrolyte imbalances on keto.
Why might magnesium supplementation be necessary on certain diets?,It helps prevent leg cramps and maintains electrolyte balance.,It helps prevent leg cramps and maintains electrolyte balance.
How should magnesium be consumed for optimal absorption?,Use magnesium citrate or glycinate; oxide isn't absorbed well.,Use magnesium citrate or glycinate; oxide isn't absorbed well.
Why is it important to track sodium and potassium intake?,Not enough can cause fatigue and cramps; balance is key.,Not enough can cause fatigue and cramps; balance is key.
What strategies do you use to manage electrolyte levels on a keto diet?,"Supplement with potassium, magnesium, and sodium electrolytes.","Supplement with potassium, magnesium, and sodium electrolytes."
How do electrolyte needs change when following a keto diet?,"Keto increases diuresis, flushing out electrolytes. Supplementation is needed.","Keto increases diuresis, flushing out electrolytes. Supplementation is needed."
How can one alleviate muscle cramps according to the comments?,Magnesium supplements or a lemon juice salt mix helps with cramps.,Magnesium supplements or a lemon juice salt mix helps with cramps.
What are some suggested ways to increase sodium intake?,Use Morton’s Lite Salt and flavor water with lemon for electrolytes.,Use Morton’s Lite Salt and flavor water with lemon for electrolytes.
Why might someone following a keto diet need to increase their intake of electrolytes?,"In ketosis, kidneys don't recycle electrolytes like when burning glucose.","In ketosis, kidneys don't recycle electrolytes like when burning glucose."
How can someone supplement potassium in their diet according to the discussions?,Use NuSalt or Lite Salt which contain potassium chloride.,Use NuSalt or Lite Salt which contain potassium chloride.
What are some potential problems associated with high sodium intake?,Can cause water retention and weight issues if consumed excessively.,Can cause water retention and weight issues if consumed excessively.
How does a ketogenic diet affect cholesterol levels?,Keto can spike cholesterol initially but might normalize over time.,Keto can spike cholesterol initially but might normalize over time.
"What are some factors that influence cholesterol levels, according to users?","Factors include keto adaptation, weight changes, and triglyceride/HDL ratio.","Factors include keto adaptation, weight changes, and triglyceride/HDL ratio."
What is the view on dietary fats in managing cholesterol?,Focus on healthy fats like avocados and nuts on keto.,Focus on healthy fats like avocados and nuts on keto.
How does the keto diet impact cholesterol levels according to users' experiences?,Keto can initially raise LDL but lowers triglycerides and increases HDL.,Keto can initially raise LDL but lowers triglycerides and increases HDL.
What do users believe about the safety and effectiveness of statins?,Statins are considered poison and not necessary.,Statins are considered poison and not necessary.
What factors do users mention as contributing to high cholesterol?,"Weight loss and diet, especially fats, can increase cholesterol.","Weight loss and diet, especially fats, can increase cholesterol."
How might a ketogenic diet affect cholesterol levels?,Cholesterol can increase temporarily; triglycerides may lower and HDL may rise long-term.,Cholesterol can increase temporarily; triglycerides may lower and HDL may rise long-term.
What role does LDL play in assessing cardiovascular risk?,LDL is less important than the LDL to HDL ratio; particle size matters more.,LDL is less important than the LDL to HDL ratio; particle size matters more.
What impact do genetics have on cholesterol levels?,Genetics can make it tricky; familial hypercholesterolemia could be a factor.,Genetics can make it tricky; familial hypercholesterolemia could be a factor.
What are some concerns people have about taking statins for cholesterol management?,"Statins are linked to diabetes, cancer, and dementia.","Statins are linked to diabetes, cancer, and dementia."
"How do commenters link diet to changes in lipid profiles, especially on a keto diet?",High cholesterol during weight loss is normal; keto may cause LDL increase.,High cholesterol during weight loss is normal; keto may cause LDL increase.
What role do genetics play in cholesterol levels according to users?,Genetics isn’t often discussed; focus is on diet changes and avoiding meds.,Genetics isn’t often discussed; focus is on diet changes and avoiding meds.
How do you respond when someone says they're proud of you?,"I appreciate it, and it motivates me even more!","I appreciate it, and it motivates me even more!"
What advice would you give to someone starting their journey?,Celebrate small wins and trust the process.,Celebrate small wins and trust the process.
How do you motivate yourself when things seem tough?,"Remember the end goal, and that you got this!","Remember the end goal, and that you got this!"
What is a key factor in staying motivated during a challenging journey?,"Encouragement and self-talk, like focusing on personal progress.","Encouragement and self-talk, like focusing on personal progress."
How do you deal with negative responses or doubts from others during a personal journey?,Ignore the haters and stay proud of your achievements.,Ignore the haters and stay proud of your achievements.
What role do community interactions play in personal growth and achievement?,"They provide motivation, support, and helpful advice.","They provide motivation, support, and helpful advice."
How do you feel about sharing your personal journey with others?,Sharing can be uplifting and inspires others.,Sharing can be uplifting and inspires others.
What advice would you offer to someone feeling doubtful about their progress?,Focus on how far you've come and keep pushing.,Focus on how far you've come and keep pushing.
How has the community support influenced your journey?,It has been a small light and very motivational.,It has been a small light and very motivational.
How do you feel about the progress of your journey so far?,"It's been a challenging journey, but I'm proud of my progress and committed to staying strong.","It's been a challenging journey, but I'm proud of my progress and committed to staying strong."
What advice would you give to someone starting a similar journey?,"Be patient, stay strong, and appreciate the support around you.","Be patient, stay strong, and appreciate the support around you."
How do you handle setbacks or challenges during your journey?,I try to remain positive and keep in mind that I can learn from each setback.,I try to remain positive and keep in mind that I can learn from each setback.
What is a recommended approach to tracking calorie intake on a diet?,Use a calorie counting app like MyFitnessPal or Carb Manager.,Use a calorie counting app like MyFitnessPal or Carb Manager.
How important is it to weigh food accurately for macro tracking?,"Extremely important, use a kitchen scale to be accurate.","Extremely important, use a kitchen scale to be accurate."
"Are there any concerns with using tracking apps, especially for people with certain tendencies?","Not really, just use apps to track and adjust.","Not really, just use apps to track and adjust."
How do users track their calories and macros?,Many users prefer using apps like Cronometer for tracking their calories and macros accurately.,Many users prefer using apps like Cronometer for tracking their calories and macros accurately.
What are some suggested daily dietary fat intakes mentioned?,It's suggested that humans need around 70g fat for metabolic functions.,It's suggested that humans need around 70g fat for metabolic functions.
How do community members suggest adjusting calorie intake for weight loss or maintenance?,Consider using a macro calculator and keep calories in check for weight management.,Consider using a macro calculator and keep calories in check for weight management.
What apps do you find effective for tracking your macros and calories?,I use Carb Manager and MyFitnessPal.,I use Carb Manager and MyFitnessPal.
How do you ensure accuracy when measuring food for macro tracking?,I weigh everything and avoid volumetric measurements.,I weigh everything and avoid volumetric measurements.
What are some benefits of macro tracking for weight management?,It helps manage carb intake and hit protein goals.,It helps manage carb intake and hit protein goals.
Which apps do people recommend for tracking calories and macros?,"Cronometer, Carb Manager, and MyFitnessPal are popular choices.","Cronometer, Carb Manager, and MyFitnessPal are popular choices."
Why is accurate tracking of food intake important?,To adjust macros correctly and ensure you're not under or overeating.,To adjust macros correctly and ensure you're not under or overeating.
How do people suggest dealing with the potential inaccuracy of calorie calculators?,Don't rely solely on them; weigh your food for more accuracy.,Don't rely solely on them; weigh your food for more accuracy.
Why do some people feel the need to take a multivitamin or supplements regularly?,Some believe they might not get all essential nutrients from diet alone.,Some believe they might not get all essential nutrients from diet alone.
How can one determine if they have a vitamin B12 deficiency?,You need to check your bloodwork regularly to be sure.,You need to check your bloodwork regularly to be sure.
What are some dietary sources of vitamin B12 mentioned in the discussions?,"Meat, dairy, and some fortified foods can provide B12.","Meat, dairy, and some fortified foods can provide B12."
What are some reasons people might choose to take vitamin supplements?,To address deficiencies or specific conditions as determined by a doctor.,To address deficiencies or specific conditions as determined by a doctor.
How do omnivores and vegans differ in their approach to vitamin B12 supplementation?,Omnivores may not focus much on B12 since it's available in animal products.,Omnivores may not focus much on B12 since it's available in animal products.
Why might someone be advised to use a multivitamin according to these discussions?,To cover potential nutrient gaps after consulting with a healthcare provider.,To cover potential nutrient gaps after consulting with a healthcare provider.
What are the various sources or methods people use to obtain vitamin B12 in their diets?,Animal organs and eggs are great B12 sources.,Animal organs and eggs are great B12 sources.
How do people perceive the need for a multivitamin?,Multivitamins offer inexpensive insurance for nutrients.,Multivitamins offer inexpensive insurance for nutrients.
What concerns do people have about overdosing on B12 or other vitamins?,B12 is water-soluble; excess is harmless.,B12 is water-soluble; excess is harmless.
What are common factors that lead people to take supplements?,Deficiencies or imbalances not corrected through diet.,Deficiencies or imbalances not corrected through diet.
How do people usually ensure they're getting enough vitamin D?,Taking vitamin D supplements and spending time in the sun.,Taking vitamin D supplements and spending time in the sun.
Why might someone be hesitant to consume multivitamins?,Multivitamins mix too many nutrients and might not offer much.,Multivitamins mix too many nutrients and might not offer much.
How do you handle situations where your dietary preferences aren't accommodated at a gathering?,I bring my own food or eat beforehand.,I bring my own food or eat beforehand.
What would you do if someone continuously pressures you to eat something you don't want?,"I firmly say ""no thanks"" and stick to my choices.","I firmly say ""no thanks"" and stick to my choices."
How do you feel about changing meal plans to accommodate a vegan guest at a party?,It's fine as long as there's something for everyone.,It's fine as long as there's something for everyone.
How do you handle attending a family dinner if you're on a specific diet or have dietary restrictions?,I usually bring my own food or eat beforehand.,I usually bring my own food or eat beforehand.
What approach do you take when being offered food at social gatherings that you cannot eat?,I often politely refuse and say I'm full.,I often politely refuse and say I'm full.
How do you navigate situations where the menu at a party or dinner isn't compatible with your diet?,I just choose to eat the least problematic option or refuse.,I just choose to eat the least problematic option or refuse.
How do you handle attending gatherings where the food options don't meet your dietary preferences?,Bring your own food or decline what's offered.,Bring your own food or decline what's offered.
What would you do if family members pressured you into eating something against your dietary choices at a party?,Politely decline and stick to your choices.,Politely decline and stick to your choices.
How do you approach a family meal if you have dietary restrictions?,Mention your diet and offer to bring your own dish.,Mention your diet and offer to bring your own dish.
How do you handle dining at a restaurant when there are no suitable options for your diet?,I prefer to look at the menu online beforehand and eat before arriving if necessary.,I prefer to look at the menu online beforehand and eat before arriving if necessary.
What is your approach when attending a family gathering where your dietary preferences aren't accommodated?,I eat beforehand and politely refuse unwanted food during the event.,I eat beforehand and politely refuse unwanted food during the event.
How do you respond when someone offers you food that doesn't meet your dietary needs at a social event?,I politely but firmly refuse and may mention fasting if needed.,I politely but firmly refuse and may mention fasting if needed.
How do members of each subreddit manage constipation through dietary or lifestyle changes?,"Many use psyllium husk, increase fiber intake, or take stool softeners.","Many use psyllium husk, increase fiber intake, or take stool softeners."
What are the views on using probiotics in the subreddits?,Some believe keto probiotics work well for maintaining gut balance.,Some believe keto probiotics work well for maintaining gut balance.
How do individuals in each subreddit address bloating and digestive discomfort?,"They recommend adjusting fiber intake, increasing water, and considering electrolyte balance.","They recommend adjusting fiber intake, increasing water, and considering electrolyte balance."
What are some common dietary changes that help with constipation?,Increase fat intake or use psyllium husk.,Increase fat intake or use psyllium husk.
How do people cope with bloating when trying new diets?,Gradually adapt; cut down on certain foods if needed.,Gradually adapt; cut down on certain foods if needed.
What are some reasons people might avoid using psyllium husk?,It can be hard to consume; might cause discomfort.,It can be hard to consume; might cause discomfort.
How do people typically deal with constipation related to dietary changes?,Many use magnesium or milk of magnesia; adding fiber like flaxseed gradually can help.,Many use magnesium or milk of magnesia; adding fiber like flaxseed gradually can help.
What role do probiotics play in managing digestive health?,"Probiotics help stabilize the gut and improve the microbiome, which assists in digestion.","Probiotics help stabilize the gut and improve the microbiome, which assists in digestion."
"How do individuals address bloating in their diets, particularly with certain foods?","Assess dairy intake, as it can contribute to bloating; sometimes reducing water-heavy foods helps.","Assess dairy intake, as it can contribute to bloating; sometimes reducing water-heavy foods helps."
What dietary approaches help with managing IBS symptoms?,"Increasing fiber, trying keto or carnivore, avoiding trigger foods.","Increasing fiber, trying keto or carnivore, avoiding trigger foods."
How can fiber intake affect bowel movements?,Too much fiber can cause constipation; balance with magnesium.,Too much fiber can cause constipation; balance with magnesium.
What role does the gut microbiome play in digestive health?,A disrupted microbiome can lead to gut issues; probiotics can help.,A disrupted microbiome can lead to gut issues; probiotics can help.
